{
  "schema_version": "1.0",
  "strategy_id": "bollinger_reversal_ref",
  "version": 1,
  "name": "Bollinger reversal (reference migration)",
  "description": "Mean reversion: long when close is below the lower band, short when above the upper band, flat inside the bands (instant semantics).",
  "source": {
    "type": "HUMAN",
    "reference": "mql5bot.strategies.bollinger_reversal"
  },
  "hypothesis": {
    "statement": "Extremes beyond 2 deviations snap back.",
    "expected_regime": "RANGE",
    "expected_failure_regime": "TREND",
    "expected_holding_bars": [
      1,
      20
    ],
    "expected_trade_frequency": "high",
    "risk_assumptions": "Band distance normalizes entry geometry."
  },
  "market": {
    "symbol": "EURUSD",
    "timeframe": "H1"
  },
  "indicators": [
    {
      "id": "bb",
      "kind": "BBANDS",
      "period": 20,
      "dev": 2.0,
      "applied": "close"
    }
  ],
  "entry": {
    "mode": "instant",
    "long": {
      "left": {
        "price": "close"
      },
      "cmp": "LT",
      "right": {
        "ind": "bb__lower"
      }
    },
    "short": {
      "left": {
        "price": "close"
      },
      "cmp": "GT",
      "right": {
        "ind": "bb__upper"
      }
    }
  },
  "exit": {
    "sl": {
      "model": "atr",
      "mult": 2.5
    },
    "tp": {
      "model": "atr",
      "mult": 3.5
    }
  },
  "filters": {},
  "risk": {
    "note": "Stops constrain trade geometry only; position risk is authorized solely by the Aegis Risk Engine."
  },
  "metadata": {
    "regime_tags": [
      "mean_reversion"
    ],
    "requires_codegen": false,
    "missing_features": []
  }
}
