{
  "schema_version": "1.0",
  "strategy_id": "ema_crossover_ref",
  "version": 1,
  "name": "EMA crossover (reference migration)",
  "description": "Trend following: hold long while fast EMA is above slow EMA, short while below. Deterministic DSL migration of strategies.ema_crossover (registry default parameters).",
  "source": {
    "type": "HUMAN",
    "reference": "mql5bot.strategies.ema_crossover"
  },
  "hypothesis": {
    "statement": "Captures medium-term directional drift when fast/slow EMA alignment persists.",
    "expected_regime": "TREND_UP/TREND_DOWN",
    "expected_failure_regime": "RANGE",
    "expected_holding_bars": [
      10,
      120
    ],
    "expected_trade_frequency": "low",
    "risk_assumptions": "ATR stop absorbs noise of the traded timeframe."
  },
  "market": {
    "symbol": "EURUSD",
    "timeframe": "H1"
  },
  "indicators": [
    {
      "id": "ema_fast",
      "kind": "EMA",
      "period": 10,
      "applied": "close"
    },
    {
      "id": "ema_slow",
      "kind": "EMA",
      "period": 30,
      "applied": "close"
    }
  ],
  "entry": {
    "mode": "state",
    "long": {
      "left": {
        "ind": "ema_fast"
      },
      "cmp": "GT",
      "right": {
        "ind": "ema_slow"
      }
    },
    "short": {
      "left": {
        "ind": "ema_fast"
      },
      "cmp": "LT",
      "right": {
        "ind": "ema_slow"
      }
    }
  },
  "exit": {
    "sl": {
      "model": "atr",
      "mult": 2.5
    },
    "tp": {
      "model": "atr",
      "mult": 4.0
    }
  },
  "filters": {},
  "risk": {
    "note": "Stops constrain trade geometry only; position risk is authorized solely by the Aegis Risk Engine."
  },
  "metadata": {
    "regime_tags": [
      "trend"
    ],
    "explanation": "State mode: position persists while alignment holds; opposite alignment flips it.",
    "requires_codegen": false,
    "missing_features": []
  }
}
